{
  "coordinates": "normalized",
  "frames": [
    {
      "landmarks": [
        {
          "index": 0,
          "presence": 0.99,
          "visibility": 0.98,
          "x": 0.5,
          "y": 0.13,
          "z": 0.0
        },
        {
          "index": 1,
          "presence": 0.99,
          "visibility": 0.98,
          "x": 0.485,
          "y": 0.12,
          "z": 0.0012
        },
        {
          "index": 2,
          "presence": 0.99,
          "visibility": 0.98,
          "x": 0.475,
          "y": 0.12,
          "z": 0.002
        },
        {
          "index": 3,
          "presence": 0.99,
          "visibility": 0.98,
          "x": 0.465,
          "y": 0.125,
          "z": 0.0028
        },
        {
          "index": 4,
          "presence": 0.99,
          "visibility": 0.98,
          "x": 0.515,
          "y": 0.12,
          "z": -0.0012
        },
        {
          "index": 5,
          "presence": 0.99,
          "visibility": 0.98,
          "x": 0.525,
          "y": 0.12,
          "z": -0.002
        },
        {
          "index": 6,
          "presence": 0.99,
          "visibility": 0.98,
          "x": 0.535,
          "y": 0.125,
          "z": -0.0028
        },
        {
          "index": 7,
          "presence": 0.99,
          "visibility": 0.98,
          "x": 0.445,
          "y": 0.14,
          "z": 0.0044
        },
        {
          "index": 8,
          "presence": 0.99,
          "visibility": 0.98,
          "x": 0.555,
          "y": 0.14,
          "z": -0.0044
        },
        {
          "index": 9,
          "presence": 0.99,
          "visibility": 0.98,
          "x": 0.485,
          "y": 0.155,
          "z": 0.0012
        },
        {
          "index": 10,
          "presence": 0.99,
          "visibility": 0.98,
          "x": 0.515,
          "y": 0.155,
          "z": -0.0012
        },
        {
          "index": 11,
          "presence": 0.99,
          "visibility": 0.98,
          "x": 0.42,
          "y": 0.27,
          "z": 0.0064
        },
        {
          "index": 12,
          "presence": 0.99,
          "visibility": 0.98,
          "x": 0.58,
          "y": 0.27,
          "z": -0.0064
        },
        {
          "index": 13,
          "presence": 0.99,
          "visibility": 0.98,
          "x": 0.36,
          "y": 0.42,
          "z": 0.0112
        },
        {
          "index": 14,
          "presence": 0.99,
          "visibility": 0.98,
          "x": 0.64,
          "y": 0.42,
          "z": -0.0112
        },
        {
          "index": 15,
          "presence": 0.99,
          "visibility": 0.98,
          "x": 0.32,
          "y": 0.57,
          "z": 0.0144
        },
        {
          "index": 16,
          "presence": 0.99,
          "visibility": 0.98,
          "x": 0.68,
          "y": 0.57,
          "z": -0.0144
        },
        {
          "index": 17,
          "presence": 0.99,
          "visibility": 0.98,
          "x": 0.3,
          "y": 0.59,
          "z": 0.016
        },
        {
          "index": 18,
          "presence": 0.99,
          "visibility": 0.98,
          "x": 0.7,
          "y": 0.59,
          "z": -0.016
        },
        {
          "index": 19,
          "presence": 0.99,
          "visibility": 0.98,
          "x": 0.31,
          "y": 0.58,
          "z": 0.0152
        },
        {
          "index": 20,
          "presence": 0.99,
          "visibility": 0.98,
          "x": 0.69,
          "y": 0.58,
          "z": -0.0152
        },
        {
          "index": 21,
          "presence": 0.99,
          "visibility": 0.98,
          "x": 0.33,
          "y": 0.56,
          "z": 0.0136
        },
        {
          "index": 22,
          "presence": 0.99,
          "visibility": 0.98,
          "x": 0.67,
          "y": 0.56,
          "z": -0.0136
        },
        {
          "index": 23,
          "presence": 0.99,
          "visibility": 0.98,
          "x": 0.455,
          "y": 0.53,
          "z": 0.0036
        },
        {
          "index": 24,
          "presence": 0.99,
          "visibility": 0.98,
          "x": 0.545,
          "y": 0.53,
          "z": -0.0036
        },
        {
          "index": 25,
          "presence": 0.99,
          "visibility": 0.98,
          "x": 0.44,
          "y": 0.72,
          "z": 0.0048
        },
        {
          "index": 26,
          "presence": 0.99,
          "visibility": 0.98,
          "x": 0.56,
          "y": 0.72,
          "z": -0.0048
        },
        {
          "index": 27,
          "presence": 0.99,
          "visibility": 0.98,
          "x": 0.43,
          "y": 0.91,
          "z": 0.0056
        },
        {
          "index": 28,
          "presence": 0.99,
          "visibility": 0.98,
          "x": 0.57,
          "y": 0.91,
          "z": -0.0056
        },
        {
          "index": 29,
          "presence": 0.99,
          "visibility": 0.98,
          "x": 0.42,
          "y": 0.94,
          "z": 0.0064
        },
        {
          "index": 30,
          "presence": 0.99,
          "visibility": 0.98,
          "x": 0.58,
          "y": 0.94,
          "z": -0.0064
        },
        {
          "index": 31,
          "presence": 0.99,
          "visibility": 0.98,
          "x": 0.45,
          "y": 0.96,
          "z": 0.004
        },
        {
          "index": 32,
          "presence": 0.99,
          "visibility": 0.98,
          "x": 0.55,
          "y": 0.96,
          "z": -0.004
        }
      ],
      "timestamp_ms": 0
    },
    {
      "landmarks": [
        {
          "index": 0,
          "presence": 0.99,
          "visibility": 0.98,
          "x": 0.5,
          "y": 0.13,
          "z": 0.0
        },
        {
          "index": 1,
          "presence": 0.99,
          "visibility": 0.98,
          "x": 0.485,
          "y": 0.12,
          "z": 0.0012
        },
        {
          "index": 2,
          "presence": 0.99,
          "visibility": 0.98,
          "x": 0.475,
          "y": 0.12,
          "z": 0.002
        },
        {
          "index": 3,
          "presence": 0.99,
          "visibility": 0.98,
          "x": 0.465,
          "y": 0.125,
          "z": 0.0028
        },
        {
          "index": 4,
          "presence": 0.99,
          "visibility": 0.98,
          "x": 0.515,
          "y": 0.12,
          "z": -0.0012
        },
        {
          "index": 5,
          "presence": 0.99,
          "visibility": 0.98,
          "x": 0.525,
          "y": 0.12,
          "z": -0.002
        },
        {
          "index": 6,
          "presence": 0.99,
          "visibility": 0.98,
          "x": 0.535,
          "y": 0.125,
          "z": -0.0028
        },
        {
          "index": 7,
          "presence": 0.99,
          "visibility": 0.98,
          "x": 0.445,
          "y": 0.14,
          "z": 0.0044
        },
        {
          "index": 8,
          "presence": 0.99,
          "visibility": 0.98,
          "x": 0.555,
          "y": 0.14,
          "z": -0.0044
        },
        {
          "index": 9,
          "presence": 0.99,
          "visibility": 0.98,
          "x": 0.485,
          "y": 0.155,
          "z": 0.0012
        },
        {
          "index": 10,
          "presence": 0.99,
          "visibility": 0.98,
          "x": 0.515,
          "y": 0.155,
          "z": -0.0012
        },
        {
          "index": 11,
          "presence": 0.99,
          "visibility": 0.98,
          "x": 0.42,
          "y": 0.27,
          "z": 0.0064
        },
        {
          "index": 12,
          "presence": 0.99,
          "visibility": 0.98,
          "x": 0.58,
          "y": 0.27,
          "z": -0.0064
        },
        {
          "index": 13,
          "presence": 0.99,
          "visibility": 0.98,
          "x": 0.299378,
          "y": 0.350718,
          "z": 0.01605
        },
        {
          "index": 14,
          "presence": 0.99,
          "visibility": 0.98,
          "x": 0.700622,
          "y": 0.350718,
          "z": -0.01605
        },
        {
          "index": 15,
          "presence": 0.99,
          "visibility": 0.98,
          "x": 0.259378,
          "y": 0.500718,
          "z": 0.01925
        },
        {
          "index": 16,
          "presence": 0.99,
          "visibility": 0.98,
          "x": 0.740622,
          "y": 0.500718,
          "z": -0.01925
        },
        {
          "index": 17,
          "presence": 0.99,
          "visibility": 0.98,
          "x": 0.239378,
          "y": 0.520718,
          "z": 0.02085
        },
        {
          "index": 18,
          "presence": 0.99,
          "visibility": 0.98,
          "x": 0.760622,
          "y": 0.520718,
          "z": -0.02085
        },
        {
          "index": 19,
          "presence": 0.99,
          "visibility": 0.98,
          "x": 0.249378,
          "y": 0.510718,
          "z": 0.02005
        },
        {
          "index": 20,
          "presence": 0.99,
          "visibility": 0.98,
          "x": 0.750622,
          "y": 0.510718,
          "z": -0.02005
        },
        {
          "index": 21,
          "presence": 0.99,
          "visibility": 0.98,
          "x": 0.269378,
          "y": 0.490718,
          "z": 0.01845
        },
        {
          "index": 22,
          "presence": 0.99,
          "visibility": 0.98,
          "x": 0.730622,
          "y": 0.490718,
          "z": -0.01845
        },
        {
          "index": 23,
          "presence": 0.99,
          "visibility": 0.98,
          "x": 0.455,
          "y": 0.53,
          "z": 0.0036
        },
        {
          "index": 24,
          "presence": 0.99,
          "visibility": 0.98,
          "x": 0.545,
          "y": 0.53,
          "z": -0.0036
        },
        {
          "index": 25,
          "presence": 0.99,
          "visibility": 0.98,
          "x": 0.44,